{
  "$schema": "https://raw.githubusercontent.com/grollat/carpool/main/schema/carpool.schema.json",
  "specVersion": "1",
  "match": ["npm:@kimsungwhee/apple-docs-mcp"],
  "isolation": "shared",
  "reason": "Only caches public Apple documentation, which benefits from sharing.",
  "partition": { "env": ["DEFAULT_ACCEPT_LANGUAGE", "DISABLE_DNT", "DISABLE_LANGUAGE_ROTATION", "DISABLE_SEC_FETCH", "SIMPLE_HEADERS_MODE", "MCP_DEBUG"], "cwd": false },
  "scaling": { "maxConcurrentRequests": 8, "maxInstances": 4 }
}
