{
  "$schema": "https://raw.githubusercontent.com/grollat/carpool/main/schema/carpool.schema.json",
  "specVersion": "1",
  "match": ["npm:@modelcontextprotocol/server-everything"],
  "isolation": "session",
  "reason": "Protocol test fixture: subscriptions, timers, sampling, elicitation and roots."
}
