{
  "$schema": "https://raw.githubusercontent.com/grollat/carpool/main/schema/carpool.schema.json",
  "specVersion": "1",
  "match": ["npm:@modelcontextprotocol/server-filesystem"],
  "isolation": "session",
  "reason": "Client roots replace a process-wide allowed-directories list, so each session needs its own process."
}
