{
  "$schema": "https://raw.githubusercontent.com/grollat/carpool/main/schema/carpool.schema.json",
  "specVersion": "1",
  "match": ["npm:@modelcontextprotocol/server-memory"],
  "isolation": "session",
  "reason": "Writes are serialized, so sharing is technically safe, but every session would see one knowledge graph. Opt in with an override if your agents should share memory."
}
