{
  "$schema": "https://raw.githubusercontent.com/grollat/carpool/main/schema/carpool.schema.json",
  "specVersion": "1",
  "match": ["npm:@modelcontextprotocol/server-sequential-thinking"],
  "isolation": "session",
  "reason": "Thought history and branches accumulate in process memory; sharing would leak one agent's reasoning into another's."
}
